"GHO","PUBLISHSTATE","YEAR","REGION","WORLDBANKINCOMEGROUP","COUNTRY","Display Value","Numeric","Low","High","Comments"
"HWWS_2","PUBLISHED","2007","AFR","WB_LI","GHA","2","2.00000","","","Scott BE, Lawson DW, Curtis V. Hard to handle: understanding mothers’ handwashing behaviour in Ghana. Health Policy and Planning. 2007 Jul 1;22(4):216 -224."
"HWWS_2","PUBLISHED","2010","AFR","WB_LI","KEN","34","34.00000","","","Aunger R, Schmidt W, Ranpura A, Coombes Y, Maina PM, Matiko CN, et al. Three kinds of psychological determinants for hand-washing behaviour in Kenya. Soc Sci Med. 2010;70(3):383-391. "
"HWWS_2","PUBLISHED","2005","AFR","WB_LI","SEN","18","18.00000","","","Senegal MGP-Afrique. Rapport Provisoire: Initiative de partenariat public/privé de lavage des mains. Situtation de référence en matière de lavage des mains au Sénégal, Dakar.  Senegal MGP-Afrique; 2005."
"HWWS_2","PUBLISHED","2007","AFR","WB_LI","UGA","19/11","19.00000","","","Steadman International. Formative research and baseline survey on handwashing with soap.  Kampala: 2007."
"HWWS_2","PUBLISHED","2005","EUR","WB_LI","KGZ","0","0.00000","","","Biran A, Tabyshalieva A, Salmorbekova Z. Formative research for hygiene promotion in Kyrgyzstan. Health Policy Plan. 2005 Jul;20(4):213-221."
"HWWS_2","PUBLISHED","2010","SEAR","WB_LI","BGD","30","30.00000","","","Luby SP, Kadir MA, Yushuf Sharker MA, Yeasmin F, Unicomb L, Sirajul Islam M. A community-randomised controlled trial promoting waterless hand sanitizer and handwashing with soap, Dhaka, Bangladesh. Tropical Medicine & International Health. 2010;15:1508-1516."
