"GHO","PUBLISHSTATE","YEAR","REGION","COUNTRY","Display Value","Numeric","Low","High","Comments"
"WHS4_154","PUBLISHED","2003","EUR","FRA","98.8","98.80000","","","Blondel B, Kermarrec M (Institut National de la santé et de la recherche médicale/INSERM [France]); 2011. Blondel B, Kermarrec M, editors (Institut National de la santé et de la recherche médicale/INSERM). Enquête nationale périnatale 2010. Les naissances en 2010 et leur évolution depuis 2003. Paris: INSERM, Direction générale de la sante (DGS), Direction de la recherche, des études, de l’évaluation et des statistiques, Ministère de l'Emploi et de la solidarité (DREES); 2011 (in French)."
"WHS4_154","PUBLISHED","2010","EUR","FRA","98.9","98.90000","","","Blondel B, Kermarrec M (Institut National de la santé et de la recherche médicale/INSERM [France]); 2011. Blondel B, Kermarrec M, editors (Institut National de la santé et de la recherche médicale/INSERM). Enquête nationale périnatale 2010. Les naissances en 2010 et leur évolution depuis 2003. Paris: INSERM, Direction générale de la sante (DGS), Direction de la recherche, des études, de l’évaluation et des statistiques, Ministère de l'Emploi et de la solidarité (DREES); 2011 (in French)."
"WHS4_154","PUBLISHED","2016","EUR","FRA","99.2","99.20000","","","Institut National de la santé et de la recherche médicale (INSERM) [France], Direction de la recherche, des études, de l’évaluation et des statistiques (DREES) [France]; 2017.Enquête nationale périnatale Rapport 2016. Les naissances et les établissements. Situation et évaluation depuis 2010. Paris: Institut National de la santé et de la recherche médicale (INSERM), Direction de la recherche, des études, de l’évaluation et des statistiques, Ministère de l'Emploi et de la solidarité (DREES); 2017 (in French)."
"WHS4_154","PUBLISHED","1995-2000","AFR","GAB","63.3","63.30000","","","DHS 2000.  Direction Générale de la Statistique et des Études Économiques (DGSEE) [Gabon], ORC Macro. Enquête Démographique et de Santé Gabon 2000. Calverton, Maryland: Direction Générale de la Statistique et des Études Économiques, Fonds des Nations Unies pour la population (FNUAP/UNFPA), ORC Macro; 2001 (in French)."
"WHS4_154","PUBLISHED","2007-2012","AFR","GAB","77.6","77.60000","","","DHS 2012.Direction Générale de la Statistique (DGS), ICF International. Enquête Démographique et de Santé du Gabon 2012. Calverton, Maryland, Libreville, Gabon: DGS, ICF International; 2013 (in French)."
"WHS4_154","PUBLISHED","2008-2010","AFR","GMB","72","72.00000","","","MICS 2010. The Gambia Bureau of Statistics (GBOS). The Gambia Multiple Indicator Cluster Survey 2010, Final Report. Banjul, The Gambia: The Gambia Bureau of Statistics (GBOS); 2012."
"WHS4_154","PUBLISHED","2008-2013","AFR","GMB","77.6","77.60000","","","DHS 2013. The Gambia Bureau of Statistics (GBOS), ICF International. The Gambia Demographic and Health Survey 2013. Banjul, The Gambia, Rockville, Maryland, USA: GBOS, ICF International; 2014. "
"WHS4_154","PUBLISHED","2016-2018","AFR","GMB","75.6","75.60000","","","MICS 2018. The Gambia Multiple Indicator Cluster Survey 2018, Survey Findings Report. Banjul: The Gambia Bureau of Statistics (GBOS); 2019."
"WHS4_154","PUBLISHED","1999-2000","EUR","GEO","75.6","75.60000","","","MICS 1999.  Republic of Georgia Multiple Indicator Cluster Survey, 1999. Tbilisi: State Department of Statistics, National Center for Disease Control, United Nations Children's Fund (UNICEF); 2000."
"WHS4_154","PUBLISHED","2000","EUR","GEO","61.6","61.60000","","","Ministry of Labour, Health and Social Affairs of Georgia; 2011.Health Care, Statistical Yearbook 2010 Georgia. Tbilisi: Ministry of Labour, Health and Social Affairs of Georgia, National Centre for Disease Control and Public Health; 2011."
"WHS4_154","PUBLISHED","2001","EUR","GEO","59.3","59.30000","","","Ministry of Labour, Health and Social Affairs of Georgia; 2012.Health Care, Statistical Yearbook 2011 Georgia. Tbilisi: Ministry of Labour, Health and Social Affairs of Georgia, National Centre for Disease Control and Public Health; 2012."
"WHS4_154","PUBLISHED","2002","EUR","GEO","61.3","61.30000","","","Ministry of Labour, Health and Social Affairs of Georgia; 2012.Health Care, Statistical Yearbook 2011 Georgia. Tbilisi: Ministry of Labour, Health and Social Affairs of Georgia, National Centre for Disease Control and Public Health; 2012."
"WHS4_154","PUBLISHED","2003","EUR","GEO","60.6","60.60000","","","Ministry of Labour, Health and Social Affairs of Georgia; 2012.Health Care, Statistical Yearbook 2011 Georgia. Tbilisi: Ministry of Labour, Health and Social Affairs of Georgia, National Centre for Disease Control and Public Health; 2012."
"WHS4_154","PUBLISHED","2004","EUR","GEO","59.4","59.40000","","","Ministry of Labour, Health and Social Affairs of Georgia; 2012.Health Care, Statistical Yearbook 2011 Georgia. Tbilisi: Ministry of Labour, Health and Social Affairs of Georgia, National Centre for Disease Control and Public Health; 2012."
"WHS4_154","PUBLISHED","2000-2005","EUR","GEO","75","75.00000","","","RHS 2005.National Center for Disease Control (NCDC) [Georgia], Ministry of Health and Social Affairs (MOH&SA) [Georgia], Department of Statistics [Georgia], Division of Reproductive Health, Centers for Disease Control and Prevention (DRH/CDC), United Nations Population Fund (UNFPA), United States Agency for International Development (USAID). Reproductive Health Survey Georgia 2005. Final Report. Atlanta, GA: CDC; 2007."
"WHS4_154","PUBLISHED","2005","EUR","GEO","65.8","65.80000","","","Ministry of Labour, Health and Social Affairs of Georgia; 2012.Health Care, Statistical Yearbook 2011 Georgia. Tbilisi: Ministry of Labour, Health and Social Affairs of Georgia, National Centre for Disease Control and Public Health; 2012."
"WHS4_154","PUBLISHED","2006","EUR","GEO","68","68.00000","","","Ministry of Labour, Health and Social Affairs of Georgia; 2012.Health Care, Statistical Yearbook 2011 Georgia. Tbilisi: Ministry of Labour, Health and Social Affairs of Georgia, National Centre for Disease Control and Public Health; 2012."
"WHS4_154","PUBLISHED","2007","EUR","GEO","70.7","70.70000","","","Ministry of Labour, Health and Social Affairs of Georgia; 2012.Health Care, Statistical Yearbook 2011 Georgia. Tbilisi: Ministry of Labour, Health and Social Affairs of Georgia, National Centre for Disease Control and Public Health; 2012."
"WHS4_154","PUBLISHED","2008","EUR","GEO","71.8","71.80000","","","Ministry of Labour, Health and Social Affairs of Georgia; 2012.Health Care, Statistical Yearbook 2011 Georgia. Tbilisi: Ministry of Labour, Health and Social Affairs of Georgia, National Centre for Disease Control and Public Health; 2012."
"WHS4_154","PUBLISHED","2009","EUR","GEO","78.5","78.50000","","","Ministry of Labour, Health and Social Affairs of Georgia; 2012.Health Care, Statistical Yearbook 2011 Georgia. Tbilisi: Ministry of Labour, Health and Social Affairs of Georgia, National Centre for Disease Control and Public Health; 2012."
"WHS4_154","PUBLISHED","2005-2010","EUR","GEO","90.2","90.20000","","","RHS 2010.Reproductive Health Survey Georgia 2010 Final Report. Tbilisi: National Center for Disease Control and Public Health (NCDC) [Georgia], Centers for Disease Control and Prevention (DRH/CDC), United Nations Population Fund (UNFPA), United States Agency for International Development (USAID), United Nations Children’s Fund (UNICEF); 2012."
"WHS4_154","PUBLISHED","2010","EUR","GEO","83.1","83.10000","","","Ministry of Labour, Health and Social Affairs of Georgia; 2012.Health Care, Statistical Yearbook 2011 Georgia. Tbilisi: Ministry of Labour, Health and Social Affairs of Georgia, National Centre for Disease Control and Public Health; 2012."
"WHS4_154","PUBLISHED","2011","EUR","GEO","81.6","81.60000","","","Ministry of Labour, Health and Social Affairs of Georgia; 2012.Health Care, Statistical Yearbook 2011 Georgia. Tbilisi: Ministry of Labour, Health and Social Affairs of Georgia, National Centre for Disease Control and Public Health; 2012."
"WHS4_154","PUBLISHED","2012","EUR","GEO","84.2","84.20000","","","Ministry of Labour, Health and Social Affairs of Georgia; 2013.Health Care, Statistical Yearbook 2012 Georgia. Tbilisi: Ministry of Labour, Health and Social Affairs of Georgia, National Centre for Disease Control and Public Health; 2013."
"WHS4_154","PUBLISHED","2013","EUR","GEO","84.6","84.60000","","","Ministry of Labour, Health and Social Affairs of Georgia; 2014. Health Care, Statistical Yearbook 2013 Georgia. Tbilisi: Ministry of Labour, Health and Social Affairs of Georgia, National Centre for Disease Control and Public Health; 2014."
"WHS4_154","PUBLISHED","2014","EUR","GEO","86.9","86.90000","","","Ministry of Labour, Health and Social Affairs of Georgia; 2015.Health Care, Statistical Yearbook 2014 Georgia. Tbilisi: Ministry of Labour, Health and Social Affairs of Georgia, National Centre for Disease Control and Public Health; 2015."
"WHS4_154","PUBLISHED","2015","EUR","GEO","88.3","88.30000","","","Ministry of Labour, Health and Social Affairs of Georgia; 2016.Health Care, Statistical Yearbook 2015 Georgia. Tbilisi: Ministry of Labour, Health and Social Affairs of Georgia, National Centre for Disease Control and Public Health; 2016."
"WHS4_154","PUBLISHED","2016","EUR","GEO","81.2","81.20000","","","Ministry of Labour, Health and Social Affairs of Georgia; 2017.Health Care, Statistical Yearbook 2016 Georgia. Tbilisi: Ministry of Labour, Health and Social Affairs of Georgia, National Centre for Disease Control and Public Health; 2017."
"WHS4_154","PUBLISHED","1990-1993","AFR","GHA","58.9","58.90000","","","DHS 1993. Ghana Statistical Service (GSS), Macro International Inc. (MI). Ghana Demographic and Health Survey 1993. Calverton, Maryland: GSS, MI; 1994."
"WHS4_154","PUBLISHED","1993-1998","AFR","GHA","62.3","62.30000","","","DHS 1998. Ghana Statistical Service (GSS), Macro International Inc. (MI). Ghana Demographic and Health Survey 1998. Calverton, Maryland: GSS, MI; 1999."
"WHS4_154","PUBLISHED","1998-2003","AFR","GHA","69.4","69.40000","","","DHS 2003. Ghana Statistical Service (GSS), Noguchi Memorial Institute for Medical Research (NMIMR), ORC Macro. Ghana Demographic and Health Survey 2003. Calverton, Maryland: GSS, NMIMR, ORC Macro; 2004."
"WHS4_154","PUBLISHED","2002-2007","AFR","GHA","76.7","76.70000","","","Ghana Statistical Service (GSS), Ghana Health Service (GHS), Macro International. MHS 2007; 2009.Ghana Statistical Service (GSS), Ghana Health Service (GHS), Macro International. Ghana Maternal Health Survey 2007. Calverton, Maryland, USA: GSS, GHS, Macro International; 2009."
"WHS4_154","PUBLISHED","2003-2008","AFR","GHA","78.2","78.20000","","","DHS 2008. Ghana Statistical Service (GSS), Ghana Health Service (GHS), ICF Macro. Ghana Demographic and Health Survey 2008. Accra, Ghana: GSS, GHS, ICF Macro; 2009."
"WHS4_154","PUBLISHED","2009-2011","AFR","GHA","86.6","86.60000","","","MICS 2011. Ghana Statistical Service, United Nations Children's Fund (UNICEF). Ghana Multiple Indicator Cluster Survey with an Enhanced Malaria Module and Biomarker, 2011, Final Report. Accra, Ghana: Ghana Statistical Service, United Nations Children's Fund (UNICEF); 2011."
"WHS4_154","PUBLISHED","2009-2014","AFR","GHA","87.3","87.30000","","","DHS 2014. Ghana Statistical Service (GSS), Ghana Health Service (GHS), ICF International. Ghana Demographic and Health Survey 2014. Rockville, Maryland, USA: GSS, GHS, ICF International; 2015. "
"WHS4_154","PUBLISHED","2012-2017","AFR","GHA","89.3","89.30000","","","DHS 2017: Maternal Health Survey 2017. Ghana Maternal Health Survey 2017. Accra, Ghana: Ghana Statistical Service (GSS), Ghana Health Service (GHS), ICF; 2018."
"WHS4_154","PUBLISHED","2016","AMR","GRD","59.8","59.80000","","","WHO/PAHO; 2017.Health Situation in the Americas: Core Indicators 2017. Washington, DC: Pan American Health Organization/World Health Organization (PAHO/WHO), Communicable Diseases and Health Analysis/Health Information and Analysis; 2017."
"WHS4_154","PUBLISHED","2017","AMR","GRD","67","67.00000","","","WHO/PAHO; 2018.Health Situation in the Americas: Core Indicators 2018. Washington, DC: Pan American Health Organization/World Health Organization (PAHO/WHO), Evidence and Intelligence for Action in Health/Health Analysis, Metrics and Evidence; 2018."
"WHS4_154","PUBLISHED","1990-1995","AMR","GTM","65","65.00000","","","DHS 1995.Instituto Nacional de Estadística (INE), Macro International Inc. Guatemala Encuesta Nacional de Salud Materno Infantil 1995. Calverton, Maryland, USA: Macro International Inc.; 1996 (in Spanish)."
"WHS4_154","PUBLISHED","2009-2015","AMR","GTM","86.2","86.20000","","","DHS 2014-15.  Encuesta Nacional de Salud Materno Infantil (ENSMI) 2014-2015. Informe Final. Ciudad de Guatemala: Ministerio de Salud Pública y Asistencia Social (MSPAS) [Guatemala], Instituto Nacional de Estadística (INE) [Guatemala], ICF International; 2015 (in Spanish). "
"WHS4_154","PUBLISHED","1987-1992","AFR","GIN","24.5","24.50000","","","DHS 1992.  Keita ML, Bah MC, Diallo MB, Barrère B, Direction National de la Statistique et de l'Informatisation (DNSI), Agence des Etats-Unis pour le Développement International (USAID), Fonds des Nations Unies pour la Population (FNUAP/UNFPA). Enquête Démographique et de Santé, Guinée 1992. Conakry, Calverton, Maryland : DNSI, USAID, FNUAP/UNFPA; 1994 (in French)."
"WHS4_154","PUBLISHED","1994-1999","AFR","GIN","46.3","46.30000","","","DHS 1999.  Direction Nationale de la Statistique [Guinée], Macro International Inc. Enquête Démographique et de Santé, Guinée 1999. Calverton, Maryland USA: Direction Nationale de la Statistique, Macro International Inc.; 2000 (in French)."
"WHS4_154","PUBLISHED","2000-2005","AFR","GIN","48.8","48.80000","","","DHS 2005.  Direction Nationale de la Statistique (DNS) [Guinée], ORC Macro. Enquête Démographique et de Santé, Guinée 2005. Calverton, Maryland, USA: DNS, ORC Macro; 2006 (in French)."
"WHS4_154","PUBLISHED","2002-2007","AFR","GIN","50.3","50.30000","","","Ministère de l'Economie des Finances et du Plan, Direction Nationale de la Statistique [Guinée], Fonds des Nations Unies pour l’enfance (UNICEF), PAM; 2008.Enquête nationale sur l'état nutritionnel et le suivi des principaux indicateurs de survie de l'enfant. Rapport provisoire. Guinée : Ministère de l'Economie des Finances et du Plan, Direction Nationale de la Statistique [Guinée], Fonds des Nations Unies pour l’enfance (UNICEF), PAM; 2008 (in French)."
"WHS4_154","PUBLISHED","2007-2012","AFR","GIN","56.6","56.60000","","","DHS 2012. (DHS/MICS 2012).  Guinée. Enquête Démographique et de Santé et à Indicateurs Multiples (EDS-MICS 2012). Calverton, Maryland: Institut National de la Statistique [Guinée], MEASURE DHS, ICF International; 2013 (in French). "
"WHS4_154","PUBLISHED","2013-2016","AFR","GIN","50.6","50.60000","","","MICS 2016.Institut National de la Statistique [Guinée], Fonds des Nations Unies pour l'Enfance (UNICEF), USAID, le Fonds mondial [the Global Fund], Fonds des Nations Unies pour la Population (FNUAP/UNFPA), Programme des Nations Unies pour le développement (PNUD/UNDP). Enquête par grappes à indicateurs multiples (MICS 2016), Rapport final. Conakry: Institut National de la Statistique [Guinée]; 2017 (in French)."
"WHS4_154","PUBLISHED","2013-2018","AFR","GIN","35.3","35.30000","","","DHS 2018.Enquête Démographique et de Santé en Guinée 2018. Conakry, Rockville, Maryland: Institut National de la Statistique (INS), ICF; 2018 (in French)."
"WHS4_154","PUBLISHED","2008-2010","AFR","GNB","67.6","67.60000","","","MICS 2010.  Ministério da Economia, do Plano e Integração Regional – Direcção Geral do Plano, Fundo das Nações Unidas para a Infância (UNICEF). Inquérito aos Indicadores Múltiplos, Inquérito Demográfico de Saúde Reprodutiva 2010. Relatório Final. Guiné-Bissau: Ministério da Economia, do Plano e Integração Regional – Direcção Geral do Plano; 2011 (in Portuguese)."
"WHS4_154","PUBLISHED","2012-2014","AFR","GNB","64.9","64.90000","","","MICS 2014.  Ministério da Economia e Finanças, Direcção Geral do Plano Instituto Nacional de Estatística (INE), Fundo das Nações Unidas para a Infância (UNICEF). Inquérito aos Indicadores Múltiplos (MICS) 2014, Principais Resultados. Guiné-Bissau: Ministério da Economia e Finanças, Direcção Geral do Plano Instituto Nacional de Estatística (INE); 2015 (in Portuguese). "
"WHS4_154","PUBLISHED","2004-2009","AMR","GUY","78.5","78.50000","","","DHS 2009.  Ministry of Health (MOH), Bureau of Statistics (BOS), ICF Macro. Guyana Demographic and Health Survey 2009. Georgetown, Guyana: MOH, BOS, ICF Macro; 2010."
"WHS4_154","PUBLISHED","2013","AMR","GUY","95.1","95.10000","","","WHO/PAHO; 2017.Health Situation in the Americas: Core Indicators 2017. Washington, DC: Pan American Health Organization/World Health Organization (PAHO/WHO), Communicable Diseases and Health Analysis/Health Information and Analysis; 2017."
"WHS4_154","PUBLISHED","2012-2014","AMR","GUY","86.7","86.70000","","","MICS 2014.  Bureau of Statistics, Ministry of Health, United Nations Children's Fund (UNICEF). Guyana Multiple Indicator Cluster Survey 2014. Georgetown, Guyana: Bureau of Statistics, Ministry of Health, UNICEF; 2015."
"WHS4_154","PUBLISHED","1989-1995","AMR","HTI","35.6","35.60000","","","DHS 1994-1995.  Cayemittes M, Rival A, Barrère B, Lerebours G, Amédée Gédéon M (Institut Hattien de l'Enfance, Macro International Inc.). Enquête Mortalité, Morbidité et Utilisation des Services (EMMUS-II), Haïti 1994/95. Calverton, Maryland USA: Institut Hattien de l'Enfance, Macro International Inc.; 1995 (in French)."
"WHS4_154","PUBLISHED","1995-2000","AMR","HTI","44.2","44.20000","","","DHS 2000.  Cayemittes M, Placide MF, Barrère B, Mariko S, Sévère B (Ministère de la Santé Publique et de la Population, Institut Haïtien de l’Enfance, ORC Macro). Enquête Mortalité, Morbidité et Utilisation des Services, Haïti 2000. Calverton, Maryland, USA: Ministère de la Santé Publique et de la Population, Institut Haïtien de l’Enfance, ORC Macro; 2001 (in French)."
"WHS4_154","PUBLISHED","2000-2006","AMR","HTI","53.8","53.80000","","","DHS 2005-2006.Cayemittes M, Placide MF, Mariko S, Barrère B, Sévère B, Alexandre C (Ministère de la Santé Publique et de la Population, Institut Haïtien de l’Enfance, Macro International Inc.). Enquête Mortalité, Morbidité et Utilisation des Services, Haïti, 2005-2006. Calverton, Maryland, USA: Ministère de la Santé Publique et de la Population, Institut Haïtien de l’Enfance, Macro International Inc.; 2007 (in French)."
"WHS4_154","PUBLISHED","2007-2012","AMR","HTI","67.3","67.30000","","","DHS 2012.Cayemittes M, Busangu MF, de Dieu Bizimana J, Barrère B, Sévère B, Cayemittes V, Charles E (MSPP, IHE, ICF International). Enquête Mortalité, Morbidité et Utilisation des Services, Haïti, 2012. Calverton, Maryland, USA : MSPP, IHE, ICF International; 2013 (in French)."
"WHS4_154","PUBLISHED","2011-2017","AMR","HTI","66.6","66.60000","","","DHS 2016-2017. Enquête Mortalité, Morbidité et Utilisation des Services (EMMUS-VI 2016-2017). Pétion-Ville, Haïti, Rockville, Maryland, USA: Institut Haïtien de l’Enfance (IHE), ICF;  2018 (in French)."
"WHS4_154","PUBLISHED","1987-1992","AMR","HND","85","85.00000","","","Ministerio de Salud Pública [Honduras], USAID; 1993. Encuesta Nacional de Epidemiología y Salud Familiar 1991/92 (ENESF-91/92). Honduras: Ministerio de Salud Pública, Agencia de los Estados Unidos para el Desarrollo Internacional (USAID); 1993 (in Spanish)."
"WHS4_154","PUBLISHED","1991-1996","AMR","HND","65.4","65.40000","","","Secretaría de Salud de Honduras (SS), la Asociación Hondureña de Planificación de Familia (ASHONPLAFA), CDC, USAID; 1997. Encuesta Nacional de Epidemiología y Salud Familiar 1996 (ENESF-96). Informe Final. Honduras:  Secretaría de Salud de Honduras (SS), la Asociación Hondureña de Planificación de Familia (ASHONPLAFA), División de Salud Reproductiva de los Centros para el Control y Prevención de Enfermedades (CDC), Agencia de los Estados Unidos para el Desarrollo Internacional (USAID); 1997 (in Spanish)."
"WHS4_154","PUBLISHED","1996-2000","AMR","HND","58.6","58.60000","","","Secretaría de Salud de Honduras (SS), la Asociación Hondureña de Planificación de Familia (ASHONPLAFA), USAID; 2002. Encuesta Nacional de Epidemiología y Salud Familiar (ENESF-2001) y de la Encuesta Nacional de Salud Masculina (ENSM-2001). Informe Final. Honduras: Secretaría de Salud de Honduras (SS), la Asociación Hondureña de Planificación de Familia (ASHONPLAFA), Agencia de los Estados Unidos para el Desarrollo Internacional (USAID); 2002 (in Spanish)."
"WHS4_154","PUBLISHED","2000-2006","AMR","HND","80.8","80.80000","","","DHS 2005-2006.  Secretaría de Salud [Honduras], Instituto Nacional de Estadística (INE), Macro International. Encuesta Nacional de Salud y Demografía 2005-2006. Tegucigalpa, Honduras: SS, INE, Macro International; 2006 (in Spanish)."
"WHS4_154","PUBLISHED","2006-2012","AMR","HND","88.9","88.90000","","","DHS 2011-2012.  Secretaría de Salud [Honduras], Instituto Nacional de Estadística (INE), ICF International. Encuesta Nacional de Salud y Demografía 2011-2012. Tegucigalpa, Honduras: SS, INE, ICF International; 2013 (in Spanish)."
"WHS4_154","PUBLISHED","2001","EUR","ISL","98.8","98.80000","","","Directorate of Health [Iceland]. Antenatal care and age of mothers 2001; 2012. Antenatal care and age of mothers 2001 [website]. Reykjavík: Directorate of Health [Iceland]; 2012 (https://www.landlaeknir.is/tolfraedi-og-rannsoknir/tolfraedi/allt-talnaefni/, accessed 13 September 2012). "
"WHS4_154","PUBLISHED","2002","EUR","ISL","98.8","98.80000","","","Directorate of Health [Iceland]. Antenatal care and age of mothers 2002; 2012. Antenatal care and age of mothers 2002 [website]. Reykjavík: Directorate of Health [Iceland]; 2012 (https://www.landlaeknir.is/tolfraedi-og-rannsoknir/tolfraedi/allt-talnaefni/, accessed 13 September 2012). "
"WHS4_154","PUBLISHED","2003","EUR","ISL","99","99.00000","","","Directorate of Health [Iceland]. Antenatal care and age of mothers 2003; 2012. Antenatal care and age of mothers 2003 [website]. Reykjavík: Directorate of Health [Iceland]; 2012 (https://www.landlaeknir.is/tolfraedi-og-rannsoknir/tolfraedi/allt-talnaefni/, accessed 13 September 2012). "
"WHS4_154","PUBLISHED","2004","EUR","ISL","98.8","98.80000","","","Directorate of Health [Iceland]. Antenatal care and age of mothers 2004; 2012. Antenatal care and age of mothers 2004 [website]. Reykjavík: Directorate of Health [Iceland]; 2012 (https://www.landlaeknir.is/tolfraedi-og-rannsoknir/tolfraedi/allt-talnaefni/, accessed 13 September 2012). "
"WHS4_154","PUBLISHED","2005","EUR","ISL","98.4","98.40000","","","Directorate of Health [Iceland]. Antenatal care and age of mothers 2005; 2012. Antenatal care and age of mothers 2005 [website]. Reykjavík: Directorate of Health [Iceland]; 2012 (https://www.landlaeknir.is/tolfraedi-og-rannsoknir/tolfraedi/allt-talnaefni/, accessed 13 September 2012). "
"WHS4_154","PUBLISHED","2006","EUR","ISL","99","99.00000","","","Directorate of Health [Iceland]. Antenatal care and age of mothers 2006; 2012. Antenatal care and age of mothers 2006 [website]. Reykjavík: Directorate of Health [Iceland]; 2012 (https://www.landlaeknir.is/tolfraedi-og-rannsoknir/tolfraedi/allt-talnaefni/, accessed 13 September 2012). "
"WHS4_154","PUBLISHED","2007","EUR","ISL","98.6","98.60000","","","Directorate of Health [Iceland]. Antenatal care and age of mothers 2007; 2012. Antenatal care and age of mothers 2007 [website]. Reykjavík: Directorate of Health [Iceland]; 2012 (https://www.landlaeknir.is/tolfraedi-og-rannsoknir/tolfraedi/allt-talnaefni/, accessed 13 September 2012). "
"WHS4_154","PUBLISHED","2008","EUR","ISL","98.3","98.30000","","","Directorate of Health [Iceland]. Antenatal care and age of mothers 2008; 2012. Antenatal care and age of mothers 2008 [website]. Reykjavík: Directorate of Health [Iceland]; 2012 (https://www.landlaeknir.is/tolfraedi-og-rannsoknir/tolfraedi/allt-talnaefni/, accessed 13 September 2012). "
"WHS4_154","PUBLISHED","2009","EUR","ISL","98.2","98.20000","","","Directorate of Health [Iceland]; 2010. Antenatal care and age of mothers 2009 [website]. Reykjavík: Directorate of Health [Iceland]; 2010 (https://www.landlaeknir.is/tolfraedi-og-rannsoknir/tolfraedi/allt-talnaefni/, accessed 2010). "
"WHS4_154","PUBLISHED","2010","EUR","ISL","98.1","98.10000","","","Directorate of Health [Iceland]. Antenatal care and age of mothers 2010; 2012. Antenatal care and age of mothers 2010 [website]. Reykjavík: Directorate of Health [Iceland]; 2012 (https://www.landlaeknir.is/tolfraedi-og-rannsoknir/tolfraedi/allt-talnaefni/, accessed 13 September 2012). "
"WHS4_154","PUBLISHED","2011","EUR","ISL","98.2","98.20000","","","Directorate of Health [Iceland]. Antenatal care and age of mothers 2011; 2013. Antenatal care and age of mothers 2011 [website]. Reykjavík: Directorate of Health [Iceland]; 2013 (https://www.landlaeknir.is/tolfraedi-og-rannsoknir/tolfraedi/allt-talnaefni/, accessed 6 August 2013). "
"WHS4_154","PUBLISHED","2012","EUR","ISL","98.6","98.60000","","","Directorate of Health [Iceland]. Antenatal care and age of mothers 2012; 2013. Antenatal care and age of mothers 2012 [website]. Reykjavík: Directorate of Health [Iceland]; 2013 (https://www.landlaeknir.is/tolfraedi-og-rannsoknir/tolfraedi/allt-talnaefni/, accessed 6 August 2013). "
